{
  "schema_version": 1,
  "artifact_type": "delivery_art_readiness_receipt",
  "receipt_id": "art-readiness-receipt:0123456789abcdef01234567",
  "delivery_id": "delivery-698",
  "covered_work_item_ids": ["work-item-801"],
  "subject": {
    "artifact_type": "art_review_packet",
    "artifact_id": "review-packet:delivery-698-work-item-801",
    "digest_kind": "readiness-subject",
    "digest": "sha256:27660314999b36528063729ee433230e7b53f2718401bb9f2077df92bb3ef4c0"
  },
  "readiness": {
    "level": "operating-ready",
    "outcome": "ready",
    "mutation_allowed": true,
    "evaluated_at": "2026-08-08T11:30:00+08:00",
    "profile_id": "dev-integration",
    "target_scope": "art:delivery-698"
  },
  "issuer": {
    "owner_repo": "workspace-governance-control-fabric",
    "service_identity_ref": "service-identity://workspace-governance-control-fabric/dev-integration",
    "implementation_ref": "5555555555555555555555555555555555555555"
  },
  "findings": [],
  "integrity": {
    "canonicalization": "RFC8785",
    "algorithm": "sha256",
    "content_digest": "sha256:2060662f8ab4a0cd606a02a30f1890dea5116e78e1dc0350e703fe89faa14407"
  },
  "custody": {
    "state": "durable",
    "backend": "wgcf-receipt-ledger",
    "uri": "wgcf://receipts/art-readiness/art-readiness-receipt-0123456789abcdef01234567-2060662f8ab4a0cd606a02a30f1890dea5116e78e1dc0350e703fe89faa14407.json",
    "persisted_at": "2026-08-08T11:31:00+08:00",
    "supersedes": null
  }
}
